{
  "$schema": "./ficha.schema.json",
  "_meta": {
    "versao": "1.0.0",
    "gerado_por": "Onda 1 — @data-engineer + @ux-design-expert (Fenice Lab)",
    "atualizado_em": "2026-06-05",
    "fonte_da_verdade": "Este arquivo é a fonte da verdade do CONTEÚDO do portal Suprema. O HTML é o molde; a ficha é o cliente. Campos com '[X]' são placeholders a preencher.",
    "placeholder": "[X]"
  },
  "cliente": {
    "slug": "suprema",
    "nome": "Suprema Pizza",
    "segmento": "Pizzaria / Delivery",
    "cidade": "Blumenau",
    "uf": "SC",
    "logo": "Materiais/logo/suprema-logo.png",
    "wordmark": {
      "linha1": "SUPREMA",
      "linha2": "PIZZA"
    },
    "subtitulo": "Painel da Marca · Fenice Lab · 2026",
    "tagline": "Quando o queijo escorre… a pizza tá no ponto.",
    "live_label": "Ao vivo"
  },
  "contato": {
    "endereco": "Rua General Osório, 3012 — Velha, Blumenau/SC",
    "telefone": "[X]",
    "whatsapp": "[X]",
    "email": "[X]",
    "instagram": "@asupremapizza",
    "instagram_url": "https://instagram.com/asupremapizza",
    "cardapio_digital": "https://pedir.delivery/app/asupremapizza",
    "site": "https://supremapizza.fenicelab.com.br"
  },
  "tokens": {
    "_nota": "Conjunto canônico --sup-* (espelho de design-system/colors_and_type.css). Fonte única de verdade do design system.",
    "sup-carvao": "#0F0F0F",
    "sup-grafite": "#161616",
    "sup-grafite-2": "#1F1F1F",
    "sup-grafite-3": "#2A2A2A",
    "sup-preto": "#000000",
    "sup-vermelho": "#D62828",
    "sup-vermelho-dk": "#B71C1C",
    "sup-vermelho-lt": "#E84B4B",
    "sup-brasa": "#C0392B",
    "sup-branco": "#FFFFFF",
    "sup-cinza": "#9A9A9A",
    "sup-cinza-esc": "#6E6E6E",
    "sup-cinza-leg": "#B0B0B0",
    "sup-bege": "#FFEBDC",
    "sup-bege-tinta": "#1A1A1A",
    "sup-linha": "rgba(255,255,255,.08)",
    "sup-linha-forte": "rgba(255,255,255,.16)",
    "sup-ok": "#3FB950",
    "sup-aviso": "#E3A008",
    "sup-erro": "#D62828"
  },
  "tokens_wrapper": {
    "_nota": "Tokens efetivamente injetados no :root do wrapper index.html. Pixel-equivalentes ao estado atual no ar (o bloco sup-wrap-v2 usa #D62020 com !important). Mantidos separados dos canônicos --sup-* para não mudar o visual atual durante a migração.",
    "carvao": "#0F0F0F",
    "carvao-md": "#141414",
    "carvao-lt": "#1F1F1F",
    "carvao-2": "#161616",
    "dourado": "#D62020",
    "dourado-dk": "#B71C1C",
    "brasa": "#B71C1C",
    "ambar": "#D62020",
    "bege": "#FFEBDC",
    "cinza": "#9A9A9A",
    "branco": "#FFFFFF",
    "creme": "#FFFFFF",
    "kraft": "#D62020",
    "tinta": "#FFFFFF"
  },
  "tipografia": {
    "corpo": {
      "familia": "Poppins",
      "pesos": [
        300,
        400,
        500,
        600,
        700,
        800
      ],
      "fonte": "auto-hospedada (design-system/assets/fonts/fonts.css)"
    },
    "display": {
      "familia": "Saira Condensed",
      "pesos": [
        300,
        500,
        700,
        800,
        900
      ],
      "fonte": "auto-hospedada (design-system/assets/fonts/fonts.css)",
      "uso": "wordmark / títulos caixa-alta condensada pesada"
    }
  },
  "abas": [
    {
      "id": "brandbook",
      "rotulo": "Brand Book",
      "novo": false,
      "tipo": "iframe",
      "src": "design-system/brandbook/index.html",
      "src_eager": true,
      "link_externo": "design-system/apresentacao/index.html"
    },
    {
      "id": "designsystem",
      "rotulo": "Design System",
      "novo": false,
      "tipo": "iframe",
      "src": "design-system/apresentacao/design-system.html?v=20260531n",
      "src_eager": false,
      "link_externo": "design-system/apresentacao/design-system.html"
    },
    {
      "id": "grafismos",
      "rotulo": "Grafismos",
      "novo": true,
      "tipo": "iframe",
      "src": "design-system/apresentacao/grafismos.html?v=20260531a",
      "src_eager": false,
      "link_externo": "design-system/apresentacao/grafismos.html"
    },
    {
      "id": "cronograma",
      "rotulo": "Cronograma",
      "novo": true,
      "tipo": "iframe",
      "src": "design-system/operacao/cronograma/index.html",
      "src_eager": false,
      "link_externo": "design-system/operacao/cronograma/index.html"
    },
    {
      "id": "performance",
      "rotulo": "📊 Performance",
      "novo": true,
      "tipo": "iframe",
      "src": "https://central.fenicelab.com.br/portal/?surface=performance&c=suprema&embed=1",
      "src_eager": false,
      "link_externo": "https://central.fenicelab.com.br/portal/?surface=performance&c=suprema&embed=1"
    },
    {
      "id": "drive",
      "rotulo": "📸 Galeria",
      "novo": false,
      "tipo": "interno"
    },
    {
      "id": "catalogo",
      "rotulo": "📖 Catálogo",
      "novo": false,
      "tipo": "interno"
    }
  ],
  "galeria": {
    "_nota": "Banco de fotos da sessão (assets/galeria/sp-NNN.jpg). Classificação por categoria vive em assets/galeria-cat.json (ferramenta Organizar).",
    "base": "assets/galeria/",
    "categorias": [
      "sessao",
      "salgada",
      "doce",
      "borda",
      "bebida",
      "ambiente"
    ],
    "videos": {
      "base": "assets/videos/",
      "total_catalogado": 90
    },
    "arquivos": [
      "sp-002.jpg",
      "sp-003.jpg",
      "sp-004.jpg",
      "sp-005.jpg",
      "sp-007.jpg",
      "sp-008.jpg",
      "sp-009.jpg",
      "sp-010.jpg",
      "sp-011.jpg",
      "sp-012.jpg",
      "sp-013.jpg",
      "sp-014.jpg",
      "sp-015.jpg",
      "sp-016.jpg",
      "sp-017.jpg",
      "sp-018.jpg",
      "sp-019.jpg",
      "sp-020.jpg",
      "sp-021.jpg",
      "sp-022.jpg",
      "sp-023.jpg",
      "sp-024.jpg",
      "sp-025.jpg",
      "sp-026.jpg",
      "sp-027.jpg",
      "sp-028.jpg",
      "sp-029.jpg",
      "sp-030.jpg",
      "sp-034.jpg",
      "sp-037.jpg",
      "sp-038.jpg",
      "sp-039.jpg",
      "sp-040.jpg",
      "sp-041.jpg",
      "sp-042.jpg",
      "sp-043.jpg",
      "sp-044.jpg",
      "sp-045.jpg",
      "sp-046.jpg",
      "sp-047.jpg",
      "sp-048.jpg",
      "sp-049.jpg",
      "sp-050.jpg",
      "sp-051.jpg",
      "sp-052.jpg",
      "sp-053.jpg",
      "sp-054.jpg",
      "sp-055.jpg",
      "sp-056.jpg",
      "sp-057.jpg",
      "sp-058.jpg",
      "sp-059.jpg",
      "sp-060.jpg",
      "sp-061.jpg",
      "sp-062.jpg",
      "sp-063.jpg",
      "sp-064.jpg",
      "sp-065.jpg",
      "sp-066.jpg",
      "sp-067.jpg",
      "sp-068.jpg",
      "sp-069.jpg",
      "sp-070.jpg",
      "sp-071.jpg",
      "sp-072.jpg",
      "sp-074.jpg",
      "sp-075.jpg",
      "sp-076.jpg",
      "sp-078.jpg",
      "sp-079.jpg",
      "sp-080.jpg",
      "sp-081.jpg",
      "sp-082.jpg",
      "sp-083.jpg",
      "sp-084.jpg",
      "sp-085.jpg",
      "sp-086.jpg",
      "sp-087.jpg",
      "sp-089.jpg",
      "sp-090.jpg",
      "sp-091.jpg",
      "sp-092.jpg",
      "sp-093.jpg",
      "sp-094.jpg",
      "sp-095.jpg",
      "sp-097.jpg",
      "sp-098.jpg",
      "sp-100.jpg",
      "sp-101.jpg",
      "sp-102.jpg",
      "sp-103.jpg",
      "sp-104.jpg",
      "sp-105.jpg",
      "sp-106.jpg",
      "sp-107.jpg",
      "sp-108.jpg",
      "sp-109.jpg",
      "sp-111.jpg",
      "sp-112.jpg",
      "sp-113.jpg",
      "sp-114.jpg",
      "sp-115.jpg",
      "sp-116.jpg",
      "sp-117.jpg",
      "sp-118.jpg",
      "sp-119.jpg",
      "sp-120.jpg",
      "sp-121.jpg",
      "sp-122.jpg",
      "sp-123.jpg",
      "sp-124.jpg",
      "sp-125.jpg",
      "sp-126.jpg",
      "sp-127.jpg",
      "sp-128.jpg",
      "sp-129.jpg",
      "sp-130.jpg",
      "sp-132.jpg",
      "sp-133.jpg",
      "sp-134.jpg",
      "sp-135.jpg",
      "sp-136.jpg",
      "sp-137.jpg",
      "sp-138.jpg",
      "sp-139.jpg",
      "sp-141.jpg",
      "sp-142.jpg",
      "sp-143.jpg",
      "sp-144.jpg",
      "sp-145.jpg",
      "sp-146.jpg",
      "sp-147.jpg",
      "sp-148.jpg",
      "sp-149.jpg",
      "sp-150.jpg",
      "sp-151.jpg",
      "sp-152.jpg",
      "sp-153.jpg",
      "sp-154.jpg",
      "sp-155.jpg",
      "sp-156.jpg",
      "sp-157.jpg",
      "sp-158.jpg",
      "sp-159.jpg",
      "sp-160.jpg",
      "sp-161.jpg",
      "sp-162.jpg",
      "sp-163.jpg",
      "sp-164.jpg",
      "sp-165.jpg",
      "sp-167.jpg",
      "sp-168.jpg",
      "sp-172.jpg",
      "sp-184.jpg",
      "sp-188.jpg",
      "sp-200.jpg",
      "sp-202.jpg",
      "sp-219.jpg",
      "sp-246.jpg",
      "sp-248.jpg",
      "sp-254.jpg",
      "sp-267.jpg",
      "sp-283.jpg",
      "sp-297.jpg",
      "sp-323.jpg",
      "sp-324.jpg",
      "sp-325.jpg",
      "sp-326.jpg",
      "sp-327.jpg",
      "sp-329.jpg",
      "sp-330.jpg",
      "sp-331.jpg",
      "sp-332.jpg",
      "sp-333.jpg",
      "sp-334.jpg",
      "sp-335.jpg",
      "sp-336.jpg",
      "sp-337.jpg",
      "sp-338.jpg",
      "sp-339.jpg",
      "sp-340.jpg",
      "sp-341.jpg",
      "sp-342.jpg",
      "sp-343.jpg",
      "sp-344.jpg",
      "sp-345.jpg",
      "sp-346.jpg",
      "sp-347.jpg",
      "sp-348.jpg",
      "sp-349.jpg",
      "sp-350.jpg",
      "sp-351.jpg",
      "sp-352.jpg",
      "sp-353.jpg",
      "sp-354.jpg",
      "sp-355.jpg",
      "sp-356.jpg",
      "sp-357.jpg",
      "sp-358.jpg",
      "sp-359.jpg",
      "sp-360.jpg",
      "sp-361.jpg",
      "sp-362.jpg",
      "sp-363.jpg",
      "sp-365.jpg",
      "sp-366.jpg",
      "sp-367.jpg",
      "sp-368.jpg",
      "sp-369.jpg",
      "sp-370.jpg",
      "sp-371.jpg",
      "sp-372.jpg",
      "sp-373.jpg"
    ]
  }
}